Enter password: *********
Welcome to the MySQL monitor.  Commands end with ; or \g.
Your MySQL connection id is 19
Server version: 8.0.26 MySQL Community Server - GPL

Copyright (c) 2000, 2021, Oracle and/or its affiliates.

Oracle is a registered trademark of Oracle Corporation and/or its
affiliates. Other names may be trademarks of their respective
owners.

Type 'help;' or '\h' for help. Type '\c' to clear the current input statement.

mysql> create database addressbook;
Query OK, 1 row affected (0.30 sec)

mysql> show databases;
+--------------------+
| Database           |
+--------------------+
| addressbook        |
| employee           |
| information_schema |
| mysql              |
| performance_schema |
| sakila             |
| sys                |
| world              |
+--------------------+
8 rows in set (0.13 sec)

mysql> create table contactDetails (
    -> firstName varchar(150) not null,
    -> last_name varchar(150) not null,
    -> address varchar(150) not null,
    -> city varchar(150) not null,
    -> state varchar(150) not null,
    -> zip varchar(150) not null,
    -> phone_number varchar(200) not null,
    -> email varchar(120) not null
    -> );
Query OK, 0 rows affected (1.58 sec)





mysql> insert into contactDetails(firstName,last_name,address,city,state,zip,phone_number,email)values("Rushi","Bhosle","kalepadal","pune","maharastra","413518","8788586956","rushikeshb5078@gmail.com");
Query OK, 1 row affected (1.80 sec)

mysql> select * form contactDetails;
ERROR 1064 (42000): You have an error in your SQL syntax; check the manual that corresponds to your MySQL server version for the right syntax to use near 'form contactDetails' at line 1
mysql> select * from contactDetails;
+-----------+-----------+-----------+------+------------+--------+--------------+--------------------------+
| firstName | last_name | address   | city | state      | zip    | phone_number | email                    |
+-----------+-----------+-----------+------+------------+--------+--------------+--------------------------+
| Rushi     | Bhosle    | kalepadal | pune | maharastra | 413518 | 8788586956   | rushikeshb5078@gmail.com |
+-----------+-----------+-----------+------+------------+--------+--------------+--------------------------+
1 row in set (0.13 sec)

mysql> insert into contactDetails(firstName,last_name,address,city,state,zip,phone_number,email)values("Suraj","Kale","Swargate","pune","maharastra","413518","9284631453","surajk5078@gmail.com");
Query OK, 1 row affected (2.03 sec)

mysql> select * from contactDetails;
+-----------+-----------+-----------+------+------------+--------+--------------+--------------------------+
| firstName | last_name | address   | city | state      | zip    | phone_number | email                    |
+-----------+-----------+-----------+------+------------+--------+--------------+--------------------------+
| Rushi     | Bhosle    | kalepadal | pune | maharastra | 413518 | 8788586956   | rushikeshb5078@gmail.com |
| Suraj     | Kale      | swargate  | pune | maharastra | 413518 | 9284631453   | surajk5078@gmail.com     |
+-----------+-----------+-----------+------+------------+--------+--------------+--------------------------+
2 rows in set (0.00 sec)

mysql>  update contactDetails
    -> set  address = 'golai',city = 'latur'where firstName = "suraj";
Query OK, 1 row affected (0.18 sec)
Rows matched: 1  Changed: 1  Warnings: 0

mysql> select * from contactDetails;
+-----------+-----------+-----------+-------+------------+--------+--------------+--------------------------+
| firstName | last_name | address   | city  | state      | zip    | phone_number | email                    |
+-----------+-----------+-----------+-------+------------+--------+--------------+--------------------------+
| Rushi     | Bhosle    | kalepadal | pune  | maharastra | 413518 | 8788586956   | rushikeshb5078@gmail.com |
| Rushi     | Bhosle    | kalepadal | pune  | maharastra | 413518 | 8788586956   | rushikeshb5078@gmail.com |
| suraj     | kale      | golai     | latur | maharastra | 413518 | 9284631453   | surajk5078@gmail.com     |
+-----------+-----------+-----------+-------+------------+--------+--------------+--------------------------+
3 rows in set (0.00 sec)

mysql> delete from contactdetails
    -> where firstName = "suraj";
Query OK, 1 row affected (0.22 sec)

mysql> select * from contactDetails;
+-----------+-----------+-----------+------+------------+--------+--------------+--------------------------+
| firstName | last_name | address   | city | state      | zip    | phone_number | email                    |
+-----------+-----------+-----------+------+------------+--------+--------------+--------------------------+
| Rushi     | Bhosle    | kalepadal | pune | maharastra | 413518 | 8788586956   | rushikeshb5078@gmail.com |
| Rushi     | Bhosle    | kalepadal | pune | maharastra | 413518 | 8788586956   | rushikeshb5078@gmail.com |
+-----------+-----------+-----------+------+------------+--------+--------------+--------------------------+
2 rows in set (0.06 sec)

mysql> select * from contactDetails;
+-----------+-----------+------------+--------+------------+--------+--------------+--------------------------+
| firstName | last_name | address    | city   | state      | zip    | phone_number | email                    |
+-----------+-----------+------------+--------+------------+--------+--------------+--------------------------+
| Rushi     | Bhosle    | kalepadal  | pune   | maharastra | 413518 | 8788586956   | rushikeshb5078@gmail.com |
| Rushi     | Bhosle    | kalepadal  | pune   | maharastra | 413518 | 8788586956   | rushikeshb5078@gmail.com |
| laxman    | bhosle    | gokulnager | latur  | maharastra | 413695 | 8569765458   | lucky123@gmail.com       |
| omkar     | jadhav    | handenager | mumbai | maharastra | 456987 | 9865789845   | okjdhav456@gmail.com     |
| suraj     | kale      | shivnager  | bidar  | karnataka  | 456987 | 9865546845   | surajk456@gmail.com      |
+-----------+-----------+------------+--------+------------+--------+--------------+--------------------------+
5 rows in set (0.10 sec)

mysql> select * from contactDetails where city = "latur";
+-----------+-----------+------------+-------+------------+--------+--------------+--------------------+
| firstName | last_name | address    | city  | state      | zip    | phone_number | email              |
+-----------+-----------+------------+-------+------------+--------+--------------+--------------------+
| laxman    | bhosle    | gokulnager | latur | maharastra | 413695 | 8569765458   | lucky123@gmail.com |
+-----------+-----------+------------+-------+------------+--------+--------------+--------------------+
1 row in set (0.00 sec)

mysql> select * from contactDetails where city = "pune";
+-----------+-----------+-----------+------+------------+--------+--------------+--------------------------+
| firstName | last_name | address   | city | state      | zip    | phone_number | email                    |
+-----------+-----------+-----------+------+------------+--------+--------------+--------------------------+
| Rushi     | Bhosle    | kalepadal | pune | maharastra | 413518 | 8788586956   | rushikeshb5078@gmail.com |
| Rushi     | Bhosle    | kalepadal | pune | maharastra | 413518 | 8788586956   | rushikeshb5078@gmail.com |
+-----------+-----------+-----------+------+------------+--------+--------------+--------------------------+
2 rows in set (0.00 sec)

mysql> select * from contactDetails;
+-----------+-------------+--------------+------------+------------+--------+--------------+--------------------------+
| firstName | last_name   | address      | city       | state      | zip    | phone_number | email                    |
+-----------+-------------+--------------+------------+------------+--------+--------------+--------------------------+
| Rushi     | Bhosle      | kalepadal    | pune       | maharastra | 413518 | 8788586956   | rushikeshb5078@gmail.com |
| Rushi     | Bhosle      | kalepadal    | pune       | maharastra | 413518 | 8788586956   | rushikeshb5078@gmail.com |
| laxman    | bhosle      | gokulnager   | latur      | maharastra | 413695 | 8569765458   | lucky123@gmail.com       |
| omkar     | jadhav      | handenager   | mumbai     | maharastra | 456987 | 9865789845   | okjdhav456@gmail.com     |
| suraj     | kale        | shivnager    | bidar      | karnataka  | 456987 | 9865546845   | surajk456@gmail.com      |
| abhijeet  | sowmavnashi | shivnager    | pune       | maharastra | 421987 | 9865452845   | abhi456@gmail.com        |
| sham      | biradar     | adershcolony | latur      | maharastra | 413564 | 9685462845   | sham156@gmail.com        |
| vishal    | shastri     | shryanager   | aurangabad | maharastra | 410001 | 9758616845   | vishal236@gmail.com      |
| om        | pawar       | jtower       | aurangabad | maharastra | 411264 | 8879456215   | ompawar@gmail.com        |
+-----------+-------------+--------------+------------+------------+--------+--------------+--------------------------+
9 rows in set (0.03 sec)

mysql> select count(*) from city where contactDetails;
ERROR 1146 (42S02): Table 'addressbook1.city' doesn't exist
mysql> select count(*) from city where table_name = "contactDetails";
ERROR 1146 (42S02): Table 'addressbook1.city' doesn't exist
mysql> select count(*) from contactDetails where city = "pune";
+----------+
| count(*) |
+----------+
|        3 |
+----------+
1 row in set (0.34 sec)

mysql> select count(*) from contactDetails where city = "aurangabad";
+----------+
| count(*) |
+----------+
|        2 |
+----------+
1 row in set (0.00 sec)

mysql> select * from contactDetails;
+-----------+-------------+--------------+------------+------------+--------+--------------+--------------------------+
| firstName | last_name   | address      | city       | state      | zip    | phone_number | email                    |
+-----------+-------------+--------------+------------+------------+--------+--------------+--------------------------+
| Rushi     | Bhosle      | kalepadal    | pune       | maharastra | 413518 | 8788586956   | rushikeshb5078@gmail.com |
| Rushi     | Bhosle      | kalepadal    | pune       | maharastra | 413518 | 8788586956   | rushikeshb5078@gmail.com |
| laxman    | bhosle      | gokulnager   | latur      | maharastra | 413695 | 8569765458   | lucky123@gmail.com       |
| omkar     | jadhav      | handenager   | mumbai     | maharastra | 456987 | 9865789845   | okjdhav456@gmail.com     |
| suraj     | kale        | shivnager    | bidar      | karnataka  | 456987 | 9865546845   | surajk456@gmail.com      |
| abhijeet  | sowmavnashi | shivnager    | pune       | maharastra | 421987 | 9865452845   | abhi456@gmail.com        |
| sham      | biradar     | adershcolony | latur      | maharastra | 413564 | 9685462845   | sham156@gmail.com        |
| vishal    | shastri     | shryanager   | aurangabad | maharastra | 410001 | 9758616845   | vishal236@gmail.com      |
| om        | pawar       | jtower       | aurangabad | maharastra | 411264 | 8879456215   | ompawar@gmail.com        |
+-----------+-------------+--------------+------------+------------+--------+--------------+--------------------------+
9 rows in set (0.00 sec)

mysql> select * from contactDetails
    -> order by city;
+-----------+-------------+--------------+------------+------------+--------+--------------+--------------------------+
| firstName | last_name   | address      | city       | state      | zip    | phone_number | email                    |
+-----------+-------------+--------------+------------+------------+--------+--------------+--------------------------+
| vishal    | shastri     | shryanager   | aurangabad | maharastra | 410001 | 9758616845   | vishal236@gmail.com      |
| om        | pawar       | jtower       | aurangabad | maharastra | 411264 | 8879456215   | ompawar@gmail.com        |
| suraj     | kale        | shivnager    | bidar      | karnataka  | 456987 | 9865546845   | surajk456@gmail.com      |
| laxman    | bhosle      | gokulnager   | latur      | maharastra | 413695 | 8569765458   | lucky123@gmail.com       |
| sham      | biradar     | adershcolony | latur      | maharastra | 413564 | 9685462845   | sham156@gmail.com        |
| omkar     | jadhav      | handenager   | mumbai     | maharastra | 456987 | 9865789845   | okjdhav456@gmail.com     |
| Rushi     | Bhosle      | kalepadal    | pune       | maharastra | 413518 | 8788586956   | rushikeshb5078@gmail.com |
| Rushi     | Bhosle      | kalepadal    | pune       | maharastra | 413518 | 8788586956   | rushikeshb5078@gmail.com |
| abhijeet  | sowmavnashi | shivnager    | pune       | maharastra | 421987 | 9865452845   | abhi456@gmail.com        |
+-----------+-------------+--------------+------------+------------+--------+--------------+--------------------------+
9 rows in set (0.00 sec)
mysql> select * from cotactDetails;
ERROR 1146 (42S02): Table 'addressbook1.cotactdetails' doesn't exist
mysql> select * from contactDetails;
+-----------+-------------+--------------+------------+------------+--------+--------------+--------------------------+
| firstName | last_name   | address      | city       | state      | zip    | phone_number | email                    |
+-----------+-------------+--------------+------------+------------+--------+--------------+--------------------------+
| Rushi     | Bhosle      | kalepadal    | pune       | maharastra | 413518 | 8788586956   | rushikeshb5078@gmail.com |
| Rushi     | Bhosle      | kalepadal    | pune       | maharastra | 413518 | 8788586956   | rushikeshb5078@gmail.com |
| laxman    | bhosle      | gokulnager   | latur      | maharastra | 413695 | 8569765458   | lucky123@gmail.com       |
| omkar     | jadhav      | handenager   | mumbai     | maharastra | 456987 | 9865789845   | okjdhav456@gmail.com     |
| suraj     | kale        | shivnager    | bidar      | karnataka  | 456987 | 9865546845   | surajk456@gmail.com      |
| abhijeet  | sowmavnashi | shivnager    | pune       | maharastra | 421987 | 9865452845   | abhi456@gmail.com        |
| sham      | biradar     | adershcolony | latur      | maharastra | 413564 | 9685462845   | sham156@gmail.com        |
| vishal    | shastri     | shryanager   | aurangabad | maharastra | 410001 | 9758616845   | vishal236@gmail.com      |
| om        | pawar       | jtower       | aurangabad | maharastra | 411264 | 8879456215   | ompawar@gmail.com        |
+-----------+-------------+--------------+------------+------------+--------+--------------+--------------------------+
9 rows in set (0.00 sec)

mysql> alter table contactDetails add ContactType varchar(200);
Query OK, 0 rows affected (1.65 sec)
Records: 0  Duplicates: 0  Warnings: 0

mysql> select * from contactDetails;
+-----------+-------------+--------------+------------+------------+--------+--------------+--------------------------+-------------+
| firstName | last_name   | address      | city       | state      | zip    | phone_number | email                    | ContactType |
+-----------+-------------+--------------+------------+------------+--------+--------------+--------------------------+-------------+
| Rushi     | Bhosle      | kalepadal    | pune       | maharastra | 413518 | 8788586956   | rushikeshb5078@gmail.com | NULL        |
| Rushi     | Bhosle      | kalepadal    | pune       | maharastra | 413518 | 8788586956   | rushikeshb5078@gmail.com | NULL        |
| laxman    | bhosle      | gokulnager   | latur      | maharastra | 413695 | 8569765458   | lucky123@gmail.com       | NULL        |
| omkar     | jadhav      | handenager   | mumbai     | maharastra | 456987 | 9865789845   | okjdhav456@gmail.com     | NULL        |
| suraj     | kale        | shivnager    | bidar      | karnataka  | 456987 | 9865546845   | surajk456@gmail.com      | NULL        |
| abhijeet  | sowmavnashi | shivnager    | pune       | maharastra | 421987 | 9865452845   | abhi456@gmail.com        | NULL        |
| sham      | biradar     | adershcolony | latur      | maharastra | 413564 | 9685462845   | sham156@gmail.com        | NULL        |
| vishal    | shastri     | shryanager   | aurangabad | maharastra | 410001 | 9758616845   | vishal236@gmail.com      | NULL        |
| om        | pawar       | jtower       | aurangabad | maharastra | 411264 | 8879456215   | ompawar@gmail.com        | NULL        |
+-----------+-------------+--------------+------------+------------+--------+--------------+--------------------------+-------------+
9 rows in set (0.00 sec)

mysql> update contactDetails
    -> set ContactType = 'Friends'  where firstName = 'suraj';
Query OK, 1 row affected (0.09 sec)
Rows matched: 1  Changed: 1  Warnings: 0

mysql> select * from contactDetails
    -> select * from contactDetails;
ERROR 1064 (42000): You have an error in your SQL syntax; check the manual that corresponds to your MySQL server version for the right syntax to use near 'select * from contactDetails' at line 2
mysql> select * from contactDetails;
+-----------+-------------+--------------+------------+------------+--------+--------------+--------------------------+-------------+
| firstName | last_name   | address      | city       | state      | zip    | phone_number | email                    | ContactType |
+-----------+-------------+--------------+------------+------------+--------+--------------+--------------------------+-------------+
| Rushi     | Bhosle      | kalepadal    | pune       | maharastra | 413518 | 8788586956   | rushikeshb5078@gmail.com | NULL        |
| Rushi     | Bhosle      | kalepadal    | pune       | maharastra | 413518 | 8788586956   | rushikeshb5078@gmail.com | NULL        |
| laxman    | bhosle      | gokulnager   | latur      | maharastra | 413695 | 8569765458   | lucky123@gmail.com       | NULL        |
| omkar     | jadhav      | handenager   | mumbai     | maharastra | 456987 | 9865789845   | okjdhav456@gmail.com     | NULL        |
| suraj     | kale        | shivnager    | bidar      | karnataka  | 456987 | 9865546845   | surajk456@gmail.com      | Friends     |
| abhijeet  | sowmavnashi | shivnager    | pune       | maharastra | 421987 | 9865452845   | abhi456@gmail.com        | NULL        |
| sham      | biradar     | adershcolony | latur      | maharastra | 413564 | 9685462845   | sham156@gmail.com        | NULL        |
| vishal    | shastri     | shryanager   | aurangabad | maharastra | 410001 | 9758616845   | vishal236@gmail.com      | NULL        |
| om        | pawar       | jtower       | aurangabad | maharastra | 411264 | 8879456215   | ompawar@gmail.com        | NULL        |
+-----------+-------------+--------------+------------+------------+--------+--------------+--------------------------+-------------+
9 rows in set (0.03 sec)

mysql> update contactDetails
    -> set ContactType = 'Friends'  where firstName = 'Rushi';
Query OK, 2 rows affected (0.19 sec)
Rows matched: 2  Changed: 2  Warnings: 0

mysql> select * from contactDetails;
+-----------+-------------+--------------+------------+------------+--------+--------------+--------------------------+-------------+
| firstName | last_name   | address      | city       | state      | zip    | phone_number | email                    | ContactType |
+-----------+-------------+--------------+------------+------------+--------+--------------+--------------------------+-------------+
| Rushi     | Bhosle      | kalepadal    | pune       | maharastra | 413518 | 8788586956   | rushikeshb5078@gmail.com | Friends     |
| Rushi     | Bhosle      | kalepadal    | pune       | maharastra | 413518 | 8788586956   | rushikeshb5078@gmail.com | Friends     |
| laxman    | bhosle      | gokulnager   | latur      | maharastra | 413695 | 8569765458   | lucky123@gmail.com       | NULL        |
| omkar     | jadhav      | handenager   | mumbai     | maharastra | 456987 | 9865789845   | okjdhav456@gmail.com     | NULL        |
| suraj     | kale        | shivnager    | bidar      | karnataka  | 456987 | 9865546845   | surajk456@gmail.com      | Friends     |
| abhijeet  | sowmavnashi | shivnager    | pune       | maharastra | 421987 | 9865452845   | abhi456@gmail.com        | NULL        |
| sham      | biradar     | adershcolony | latur      | maharastra | 413564 | 9685462845   | sham156@gmail.com        | NULL        |
| vishal    | shastri     | shryanager   | aurangabad | maharastra | 410001 | 9758616845   | vishal236@gmail.com      | NULL        |
| om        | pawar       | jtower       | aurangabad | maharastra | 411264 | 8879456215   | ompawar@gmail.com        | NULL        |
+-----------+-------------+--------------+------------+------------+--------+--------------+--------------------------+-------------+
9 rows in set (0.10 sec)

mysql> update contactDetails
    -> set ContactType = 'Family'  where firstName = 'laxman';
Query OK, 1 row affected (0.21 sec)
Rows matched: 1  Changed: 1  Warnings: 0

mysql> select * from contactDetails;
+-----------+-------------+--------------+------------+------------+--------+--------------+--------------------------+-------------+
| firstName | last_name   | address      | city       | state      | zip    | phone_number | email                    | ContactType |
+-----------+-------------+--------------+------------+------------+--------+--------------+--------------------------+-------------+
| Rushi     | Bhosle      | kalepadal    | pune       | maharastra | 413518 | 8788586956   | rushikeshb5078@gmail.com | Friends     |
| Rushi     | Bhosle      | kalepadal    | pune       | maharastra | 413518 | 8788586956   | rushikeshb5078@gmail.com | Friends     |
| laxman    | bhosle      | gokulnager   | latur      | maharastra | 413695 | 8569765458   | lucky123@gmail.com       | Family      |
| omkar     | jadhav      | handenager   | mumbai     | maharastra | 456987 | 9865789845   | okjdhav456@gmail.com     | NULL        |
| suraj     | kale        | shivnager    | bidar      | karnataka  | 456987 | 9865546845   | surajk456@gmail.com      | Friends     |
| abhijeet  | sowmavnashi | shivnager    | pune       | maharastra | 421987 | 9865452845   | abhi456@gmail.com        | NULL        |
| sham      | biradar     | adershcolony | latur      | maharastra | 413564 | 9685462845   | sham156@gmail.com        | NULL        |
| vishal    | shastri     | shryanager   | aurangabad | maharastra | 410001 | 9758616845   | vishal236@gmail.com      | NULL        |
| om        | pawar       | jtower       | aurangabad | maharastra | 411264 | 8879456215   | ompawar@gmail.com        | NULL        |
+-----------+-------------+--------------+------------+------------+--------+--------------+--------------------------+-------------+
9 rows in set (0.00 sec)

mysql> update contactDetails
    -> set ContactType = 'Friends'  where firstName = 'vishal';
Query OK, 1 row affected (0.18 sec)
Rows matched: 1  Changed: 1  Warnings: 0

mysql> update contactDetails
    -> set ContactType = 'Family'  where firstName = 'omkar';
Query OK, 1 row affected (0.12 sec)
Rows matched: 1  Changed: 1  Warnings: 0

mysql> set ContactType = 'Family'  where firstName = 'abhijeet';
ERROR 1193 (HY000): Unknown system variable 'ContactType'
mysql> update contactDetails
    -> set ContactType = 'Family'  where firstName = 'abhijeet';
Query OK, 1 row affected (0.15 sec)
Rows matched: 1  Changed: 1  Warnings: 0

mysql> update contactDetails
    -> set ContactType = 'Profession'  where firstName = 'om';
Query OK, 1 row affected (0.24 sec)
Rows matched: 1  Changed: 1  Warnings: 0

mysql> update contactDetails
    -> set ContactType = 'Profession'  where firstName = 'sham';
Query OK, 1 row affected (0.22 sec)
Rows matched: 1  Changed: 1  Warnings: 0

mysql> select * from contactDetails;
+-----------+-------------+--------------+------------+------------+--------+--------------+--------------------------+-------------+
| firstName | last_name   | address      | city       | state      | zip    | phone_number | email                    | ContactType |
+-----------+-------------+--------------+------------+------------+--------+--------------+--------------------------+-------------+
| Rushi     | Bhosle      | kalepadal    | pune       | maharastra | 413518 | 8788586956   | rushikeshb5078@gmail.com | Friends     |
| Rushi     | Bhosle      | kalepadal    | pune       | maharastra | 413518 | 8788586956   | rushikeshb5078@gmail.com | Friends     |
| laxman    | bhosle      | gokulnager   | latur      | maharastra | 413695 | 8569765458   | lucky123@gmail.com       | Family      |
| omkar     | jadhav      | handenager   | mumbai     | maharastra | 456987 | 9865789845   | okjdhav456@gmail.com     | Family      |
| suraj     | kale        | shivnager    | bidar      | karnataka  | 456987 | 9865546845   | surajk456@gmail.com      | Friends     |
| abhijeet  | sowmavnashi | shivnager    | pune       | maharastra | 421987 | 9865452845   | abhi456@gmail.com        | Family      |
| sham      | biradar     | adershcolony | latur      | maharastra | 413564 | 9685462845   | sham156@gmail.com        | Profession  |
| vishal    | shastri     | shryanager   | aurangabad | maharastra | 410001 | 9758616845   | vishal236@gmail.com      | Friends     |
| om        | pawar       | jtower       | aurangabad | maharastra | 411264 | 8879456215   | ompawar@gmail.com        | Profession  |
+-----------+-------------+--------------+------------+------------+--------+--------------+--------------------------+-------------+
9 rows in set (0.00 sec)

mysql> select * from contactDetails;
+-----------+-------------+--------------+------------+------------+--------+--------------+--------------------------+-------------+
| firstName | last_name   | address      | city       | state      | zip    | phone_number | email                    | ContactType |
+-----------+-------------+--------------+------------+------------+--------+--------------+--------------------------+-------------+
| Rushi     | Bhosle      | kalepadal    | pune       | maharastra | 413518 | 8788586956   | rushikeshb5078@gmail.com | Friends     |
| Rushi     | Bhosle      | kalepadal    | pune       | maharastra | 413518 | 8788586956   | rushikeshb5078@gmail.com | Friends     |
| laxman    | bhosle      | gokulnager   | latur      | maharastra | 413695 | 8569765458   | lucky123@gmail.com       | Family      |
| omkar     | jadhav      | handenager   | mumbai     | maharastra | 456987 | 9865789845   | okjdhav456@gmail.com     | Family      |
| suraj     | kale        | shivnager    | bidar      | karnataka  | 456987 | 9865546845   | surajk456@gmail.com      | Friends     |
| abhijeet  | sowmavnashi | shivnager    | pune       | maharastra | 421987 | 9865452845   | abhi456@gmail.com        | Family      |
| sham      | biradar     | adershcolony | latur      | maharastra | 413564 | 9685462845   | sham156@gmail.com        | Profession  |
| vishal    | shastri     | shryanager   | aurangabad | maharastra | 410001 | 9758616845   | vishal236@gmail.com      | Friends     |
| om        | pawar       | jtower       | aurangabad | maharastra | 411264 | 8879456215   | ompawar@gmail.com        | Profession  |
+-----------+-------------+--------------+------------+------------+--------+--------------+--------------------------+-------------+
9 rows in set (0.00 sec)

mysql> select count(*) from contactDetails where ContactType = "Friends";
+----------+
| count(*) |
+----------+
|        4 |
+----------+
1 row in set (0.00 sec)

mysql> select count(*) from contactDetails where ContactType = "Family";
+----------+
| count(*) |
+----------+
|        3 |
+----------+
1 row in set (0.00 sec)

mysql> select count(*) from contactDetails where ContactType = "Profession";
+----------+
| count(*) |
+----------+
|        2 |
+----------+
1 row in set (0.00 sec)
